cve-id,published,modified,vulnStatus,descriptions,cvss3.1AV,cvss3.1AC,cvss3.1PR,cvss3.1UI,cvss3.1S,cvss3.1C,cvss3.1I,cvss3.1A,exploitabilityScore,impactScore,baseScore,baseSeverity,cwe-type
CVE-2024-22417,2024-01-23T18:15:18.860,2024-02-15T03:17:08.090,Analyzed,"Whoogle Search is a self-hosted metasearch engine. In versions 0.8.3 and prior, the `element` method in `app/routes.py` does not validate the user-controlled `src_type` and `element_url` variables and passes them to the `send` method which sends a `GET` request on lines 339-343 in `requests.py`. The returned contents of the URL are then passed to and reflected back to the user in the `send_file` function on line 484, together with the user-controlled `src_type`, which allows the attacker to control the HTTP response content type leading to a cross-site scripting vulnerability. An attacker could craft a special URL to point to a malicious website and send the link to a victim. The fact that the link would contain a trusted domain (e.g. from one of public Whoogle instances) could be used to trick the user into clicking the link. The malicious website could, for example, be a copy of a real website, meant to steal a person’s credentials to the website, or trick that person in another way. Version 0.8.4 contains a patch for this issue.",NETWORK,LOW,NONE,REQUIRED,CHANGED,LOW,LOW,NONE,2.8,2.7,6.1,MEDIUM,CWE-79
CVE-2023-47115,2024-01-23T23:15:08.100,2024-02-01T15:48:10.727,Analyzed,"Label Studio is an a popular open source data labeling tool. Versions prior to 1.9.2 have a cross-site scripting (XSS) vulnerability that could be exploited when an authenticated user uploads a crafted image file for their avatar that gets rendered as a HTML file on the website. Executing arbitrary JavaScript could result in an attacker performing malicious actions on Label Studio users if they visit the crafted avatar image. For an example, an attacker can craft a JavaScript payload that adds a new Django Super Administrator user if a Django administrator visits the image.

The file `users/functions.py` lines 18-49 show that the only verification check is that the file is an image by extracting the dimensions from the file. Label Studio serves avatar images using Django's built-in `serve` view, which is not secure for production use according to Django's documentation. The issue with the Django `serve` view is that it determines the `Content-Type` of the response by the file extension in the URL path. Therefore, an attacker can upload an image that contains malicious HTML code and name the file with a `.html` extension to be rendered as a HTML page. The only file extension validation is performed on the client-side, which can be easily bypassed.

Version 1.9.2 fixes this issue. Other remediation strategies include validating the file extension on the server side, not in client-side code; removing the use of Django's `serve` view and implement a secure controller for viewing uploaded avatar images; saving file content in the database rather than on the filesystem to mitigate against other file related vulnerabilities; and avoiding trusting user controlled inputs.",NETWORK,LOW,LOW,REQUIRED,CHANGED,LOW,LOW,NONE,2.3,2.7,5.4,MEDIUM,CWE-79
CVE-2024-0703,2024-01-23T11:15:08.880,2024-01-29T22:42:17.067,Analyzed,"The Sticky Buttons – floating buttons builder plugin for WordPress is vulnerable to Stored Cross-Site Scripting via sticky URLs in all versions up to, and including, 3.2.2 due to insufficient input sanitization and output escaping. This makes it possible for authenticated attackers, with administrator-level access, to inject arbitrary web scripts in pages that will execute whenever a user accesses an injected page. This only affects multi-site installations and installations where unfiltered_html has been disabled.",NETWORK,LOW,HIGH,REQUIRED,CHANGED,LOW,LOW,NONE,1.7,2.7,4.8,MEDIUM,CWE-79
CVE-2024-0587,2024-01-23T07:15:52.623,2024-01-30T02:04:15.073,Analyzed,"The AMP for WP – Accelerated Mobile Pages plugin for WordPress is vulnerable to Reflected Cross-Site Scripting via the 'disqus_name' parameter in all versions up to, and including, 1.0.92.1 due to insufficient input sanitization and output escaping on the executed JS file. This makes it possible for unauthenticated attackers to inject arbitrary web scripts in pages that execute if they can successfully trick a user into performing an action such as clicking on a link.",NETWORK,LOW,NONE,REQUIRED,CHANGED,LOW,LOW,NONE,2.8,2.7,6.1,MEDIUM,CWE-79
CVE-2024-22496,2024-01-23T17:15:10.543,2024-01-29T17:38:30.827,Analyzed,Cross Site Scripting (XSS) vulnerability in JFinalcms 5.0.0 allows attackers to run arbitrary code via the /admin/login username parameter.,NETWORK,LOW,NONE,REQUIRED,CHANGED,LOW,LOW,NONE,2.8,2.7,6.1,MEDIUM,CWE-79
CVE-2023-6926,2024-01-23T20:15:45.233,2024-01-29T20:56:34.097,Analyzed,"
There is an OS command injection vulnerability in Crestron AM-300 firmware version 1.4499.00018 which may enable a user of a limited-access SSH session to escalate their privileges to root-level access.

",LOCAL,LOW,LOW,NONE,UNCHANGED,HIGH,HIGH,HIGH,1.8,5.9,7.8,HIGH,CWE-78
CVE-2024-22301,2024-01-24T12:15:58.290,2024-01-30T17:44:59.847,Analyzed,"Exposure of Sensitive Information to an Unauthorized Actor vulnerability in Ignazio Scimone Albo Pretorio On line.This issue affects Albo Pretorio On line: from n/a through 4.6.6.

",NETWORK,LOW,NONE,NONE,UNCHANGED,HIGH,NONE,NONE,3.9,3.6,7.5,HIGH,CWE-200
CVE-2023-31037,2024-01-24T03:15:08.100,2024-01-31T20:11:28.867,Analyzed,"
NVIDIA Bluefield 2 and Bluefield 3 DPU BMC contains a vulnerability in ipmitool, where a root user may cause code injection by a network call. A successful exploit of this vulnerability may lead to code execution on the OS.

",NETWORK,LOW,HIGH,NONE,UNCHANGED,HIGH,HIGH,HIGH,1.2,5.9,7.2,HIGH,CWE-78
CVE-2024-22141,2024-01-24T15:15:08.730,2024-01-30T20:18:38.460,Analyzed,"Exposure of Sensitive Information to an Unauthorized Actor vulnerability in Cozmoslabs Profile Builder Pro.This issue affects Profile Builder Pro: from n/a through 3.10.0.

",NETWORK,LOW,NONE,NONE,UNCHANGED,HIGH,NONE,NONE,3.9,3.6,7.5,HIGH,CWE-200
CVE-2024-23644,2024-01-24T20:15:53.680,2024-02-02T15:47:26.253,Analyzed,"Trillium is a composable toolkit for building internet applications with async rust. In `trillium-http` prior to 0.3.12 and `trillium-client` prior to 0.5.4, insufficient validation of outbound header values may lead to request splitting or response splitting attacks in scenarios where attackers have sufficient control over headers. This only affects use cases where attackers have control of request headers, and can insert ""\r\n"" sequences. Specifically, if untrusted and unvalidated input is inserted into header names or values.

Outbound `trillium_http::HeaderValue` and `trillium_http::HeaderName` can be constructed infallibly and were not checked for illegal bytes when sending requests from the client or responses from the server. Thus, if an attacker has sufficient control over header values (or names) in a request or response that they could inject `\r\n` sequences, they could get the client and server out of sync, and then pivot to gain control over other parts of requests or responses. (i.e. exfiltrating data from other requests, SSRF, etc.)

In `trillium-http` versions 0.3.12 and later, if a header name is invalid in server response headers, the specific header and any associated values are omitted from network transmission. Additionally, if a header value is invalid in server response headers, the individual header value is omitted from network transmission. Other headers values with the same header name will still be sent. In `trillium-client` versions 0.5.4 and later, if any header name or header value is invalid in the client request headers, awaiting the client Conn returns an `Error::MalformedHeader` prior to any network access. As a workaround, Trillium services and client applications should sanitize or validate untrusted input that is included in header values and header names. Carriage return, newline, and null characters are not allowed.",NETWORK,HIGH,NONE,NONE,UNCHANGED,HIGH,HIGH,HIGH,2.2,5.9,8.1,HIGH,CWE-436
CVE-2023-52221,2024-01-24T12:15:56.907,2024-01-30T17:01:51.733,Analyzed,"Unrestricted Upload of File with Dangerous Type vulnerability in UkrSolution Barcode Scanner and Inventory manager.This issue affects Barcode Scanner and Inventory manager: from n/a through 1.5.1.

",NETWORK,LOW,NONE,NONE,UNCHANGED,HIGH,HIGH,HIGH,3.9,5.9,9.8,CRITICAL,CWE-434
CVE-2024-22284,2024-01-24T12:15:57.893,2024-01-30T17:43:02.180,Analyzed,"Deserialization of Untrusted Data vulnerability in Thomas Belser Asgaros Forum.This issue affects Asgaros Forum: from n/a through 2.7.2.

",NETWORK,LOW,NONE,NONE,UNCHANGED,HIGH,HIGH,HIGH,3.9,5.9,9.8,CRITICAL,CWE-502
CVE-2024-22154,2024-01-24T13:15:08.260,2024-01-31T20:20:56.647,Analyzed,"Exposure of Sensitive Information to an Unauthorized Actor vulnerability in SNP Digital SalesKing.This issue affects SalesKing: from n/a through 1.6.15.

",NETWORK,LOW,NONE,NONE,UNCHANGED,HIGH,NONE,NONE,3.9,3.6,7.5,HIGH,CWE-200
CVE-2024-23646,2024-01-24T20:15:53.877,2024-01-31T21:10:54.027,Analyzed,"Pimcore's Admin Classic Bundle provides a backend user interface for Pimcore. The application allows users to create zip files from available files on the site. In the 1.x branch prior to version 1.3.2, parameter `selectedIds` is susceptible to SQL Injection. Any backend user with very basic permissions can execute arbitrary SQL statements and thus alter any data or escalate their privileges to at least admin level. Version 1.3.2 contains a fix for this issue.
",NETWORK,LOW,LOW,NONE,UNCHANGED,HIGH,HIGH,HIGH,2.8,5.9,8.8,HIGH,CWE-89
CVE-2024-22135,2024-01-24T12:15:57.500,2024-01-30T17:34:58.917,Analyzed,"Unrestricted Upload of File with Dangerous Type vulnerability in WebToffee Order Export & Order Import for WooCommerce.This issue affects Order Export & Order Import for WooCommerce: from n/a through 2.4.3.

",NETWORK,LOW,HIGH,NONE,UNCHANGED,HIGH,HIGH,HIGH,1.2,5.9,7.2,HIGH,CWE-434
CVE-2024-22294,2024-01-24T12:15:58.093,2024-01-30T17:44:30.747,Analyzed,"Exposure of Sensitive Information to an Unauthorized Actor vulnerability in IP2Location IP2Location Country Blocker.This issue affects IP2Location Country Blocker: from n/a through 2.33.3.

",NETWORK,LOW,NONE,NONE,UNCHANGED,HIGH,NONE,NONE,3.9,3.6,7.5,HIGH,CWE-200
CVE-2024-23648,2024-01-24T18:15:08.877,2024-02-02T15:45:25.457,Analyzed,"Pimcore's Admin Classic Bundle provides a backend user interface for Pimcore. The password reset functionality sends to the the user requesting a password change an email containing an URL to reset its password. The URL sent contains a unique token, valid during 24 hours, allowing the user to reset its password. This token is highly sensitive ; as an attacker able to retrieve it would be able to resets the user's password. Prior to version 1.2.3, the reset-password URL is crafted using the ""Host"" HTTP header of the request sent to request a password reset. This way, an external attacker could send password requests for users, but specify a ""Host"" header of a website that they control. If the user receiving the mail clicks on the link, the attacker would retrieve the reset token of the victim and perform account takeover. Version 1.2.3 fixes this issue.",NETWORK,LOW,NONE,REQUIRED,UNCHANGED,HIGH,HIGH,HIGH,2.8,5.9,8.8,HIGH,CWE-74
CVE-2024-23649,2024-01-24T18:15:09.103,2024-02-02T15:46:30.623,Analyzed,"Lemmy is a link aggregator and forum for the fediverse. Starting in version 0.17.0 and prior to version 0.19.1, users can report private messages, even when they're neither sender nor recipient of the message. The API response to creating a private message report contains the private message itself, which means any user can just iterate over message ids to (loudly) obtain all private messages of an instance. A user with instance admin privileges can also abuse this if the private message is removed from the response, as they're able to see the resulting reports.

Creating a private message report by POSTing to `/api/v3/private_message/report` does not validate whether the reporter is the recipient of the message. lemmy-ui does not allow the sender to report the message; the API method should likely be restricted to accessible to recipients only. The API response when creating a report contains the `private_message_report_view` with all the details of the report, including the private message that has been reported:

Any authenticated user can obtain arbitrary (untargeted) private message contents. Privileges required depend on the instance configuration; when registrations are enabled without application system, the privileges required are practically none. When registration applications are required, privileges required could be considered low, but this assessment heavily varies by instance.

Version 0.19.1 contains a patch for this issue. A workaround is available. If an update to a fixed Lemmy version is not immediately possible, the API route can be blocked in the reverse proxy. This will prevent anyone from reporting private messages, but it will also prevent exploitation before the update has been applied.",NETWORK,LOW,LOW,NONE,UNCHANGED,HIGH,NONE,NONE,2.8,3.6,6.5,MEDIUM,NVD-CWE-noinfo
CVE-2024-22309,2024-01-24T12:15:58.677,2024-01-30T22:18:55.947,Analyzed,"Deserialization of Untrusted Data vulnerability in QuantumCloud ChatBot with AI.This issue affects ChatBot with AI: from n/a through 5.1.0.

",NETWORK,LOW,NONE,NONE,UNCHANGED,HIGH,HIGH,HIGH,3.9,5.9,9.8,CRITICAL,CWE-502
CVE-2024-0854,2024-01-24T10:15:09.533,2024-01-30T17:01:37.127,Analyzed,URL redirection to untrusted site ('Open Redirect') vulnerability in file access component in Synology DiskStation Manager (DSM) before 7.2.1-69057-2 allows remote authenticated users to conduct phishing attacks via unspecified vectors.,NETWORK,LOW,LOW,REQUIRED,CHANGED,LOW,LOW,NONE,2.3,2.7,5.4,MEDIUM,CWE-601
CVE-2024-22152,2024-01-24T12:15:57.700,2024-01-30T17:36:20.533,Analyzed,"Unrestricted Upload of File with Dangerous Type vulnerability in WebToffee Product Import Export for WooCommerce.This issue affects Product Import Export for WooCommerce: from n/a through 2.3.7.

",NETWORK,LOW,HIGH,NONE,UNCHANGED,HIGH,HIGH,HIGH,1.2,5.9,7.2,HIGH,CWE-434
CVE-2024-22134,2024-01-24T12:15:57.297,2024-01-30T17:07:24.310,Analyzed,"Server-Side Request Forgery (SSRF) vulnerability in Renzo Johnson Contact Form 7 Extension For Mailchimp.This issue affects Contact Form 7 Extension For Mailchimp: from n/a through 0.5.70.

",NETWORK,LOW,LOW,NONE,UNCHANGED,HIGH,NONE,NONE,2.8,3.6,6.5,MEDIUM,CWE-918
CVE-2023-50943,2024-01-24T13:15:07.953,2024-01-30T22:57:59.310,Analyzed,"Apache Airflow, versions before 2.8.1, have a vulnerability that allows a potential attacker to poison the XCom data by bypassing the protection of ""enable_xcom_pickling=False"" configuration setting resulting in poisoned data after XCom deserialization. This vulnerability is considered low since it requires a DAG author to exploit it. Users are recommended to upgrade to version 2.8.1 or later, which fixes this issue.
",NETWORK,LOW,NONE,NONE,UNCHANGED,NONE,HIGH,NONE,3.9,3.6,7.5,HIGH,CWE-502
CVE-2023-6697,2024-01-24T14:15:08.320,2024-01-30T20:25:21.367,Analyzed,"The WP Go Maps (formerly WP Google Maps) plugin for WordPress is vulnerable to Reflected Cross-Site Scripting via the map id parameter in all versions up to, and including, 9.0.28 due to insufficient input sanitization and output escaping. This makes it possible for unauthenticated attackers to inject arbitrary web scripts in pages that execute if they can successfully trick a user into performing an action such as clicking on a link.",NETWORK,LOW,NONE,REQUIRED,CHANGED,LOW,LOW,NONE,2.8,2.7,6.1,MEDIUM,CWE-79
CVE-2024-22308,2024-01-24T12:15:58.483,2024-01-30T17:45:59.927,Analyzed,"URL Redirection to Untrusted Site ('Open Redirect') vulnerability in smp7, wp.Insider Simple Membership.This issue affects Simple Membership: from n/a through 4.4.1.

",NETWORK,LOW,NONE,REQUIRED,CHANGED,LOW,LOW,NONE,2.8,2.7,6.1,MEDIUM,CWE-601
CVE-2024-23641,2024-01-24T17:15:08.600,2024-02-05T16:50:59.327,Analyzed,"SvelteKit is a web development kit. In SvelteKit 2, sending a GET request with a body eg `{}` to a built and previewed/hosted sveltekit app throws `Request with GET/HEAD method cannot have body.` and crashes the preview/hosting. After this happens, one must manually restart the app. `TRACE` requests will also cause the app to crash. Prerendered pages and SvelteKit 1 apps are not affected. `@sveltejs/adapter-node` versions 2.1.2, 3.0.3, and 4.0.1 and `@sveltejs/kit` version 2.4.3 contain a patch for this issue.",NETWORK,LOW,NONE,NONE,UNCHANGED,NONE,NONE,HIGH,3.9,3.6,7.5,HIGH,NVD-CWE-noinfo
CVE-2021-43584,2024-01-24T20:15:53.610,2024-01-31T19:50:34.763,Analyzed,DOM-based Cross Site Scripting (XSS vulnerability in 'Tail Event Logs' functionality in Nagios Nagios Cross-Platform Agent (NCPA) before 2.4.0 allows attackers to run arbitrary code via the name element when filtering for a log.,NETWORK,LOW,HIGH,REQUIRED,CHANGED,LOW,LOW,NONE,1.7,2.7,4.8,MEDIUM,CWE-79
CVE-2024-0884,2024-01-25T21:15:08.900,2024-04-11T01:24:11.290,Modified,A vulnerability was found in SourceCodester Online Tours & Travels Management System 1.0. It has been rated as critical. This issue affects the function exec of the file payment.php. The manipulation of the argument id leads to sql injection. The attack may be initiated remotely. The exploit has been disclosed to the public and may be used. The associated identifier of this vulnerability is VDB-252035.,NETWORK,LOW,NONE,NONE,UNCHANGED,HIGH,HIGH,HIGH,3.9,5.9,9.8,CRITICAL,CWE-89
CVE-2024-0891,2024-01-25T23:15:09.250,2024-04-11T01:24:11.960,Modified,A vulnerability was found in hongmaple octopus 1.0. It has been declared as problematic. Affected by this vulnerability is an unknown functionality. The manipulation of the argument description with the input <script>alert(document.cookie)</script> leads to cross site scripting. The attack can be launched remotely. The exploit has been disclosed to the public and may be used. This product does not use versioning. This is why information about affected and unaffected releases are unavailable. The associated identifier of this vulnerability is VDB-252043.,NETWORK,LOW,LOW,REQUIRED,CHANGED,LOW,LOW,NONE,2.3,2.7,5.4,MEDIUM,CWE-79
CVE-2023-6282,2024-01-25T12:15:45.917,2024-01-31T19:11:25.767,Analyzed,"IceHrm 23.0.0.OS does not sufficiently encode user-controlled input, which creates a Cross-Site Scripting (XSS) vulnerability via /icehrm/app/fileupload_page.php, in multiple parameters. An attacker could exploit this vulnerability by sending a specially crafted JavaScript payload and partially hijacking the victim's browser.",NETWORK,LOW,NONE,REQUIRED,CHANGED,LOW,LOW,NONE,2.8,2.7,6.1,MEDIUM,CWE-79
CVE-2024-0879,2024-01-25T15:15:07.713,2024-01-31T19:16:07.630,Analyzed,"
Authentication bypass in vector-admin allows a user to register to a vector-admin server while “domain restriction” is active, even when not owning an authorized email address.


",NETWORK,LOW,LOW,NONE,UNCHANGED,NONE,LOW,NONE,2.8,1.4,4.3,MEDIUM,CWE-287
CVE-2024-0890,2024-01-25T23:15:09.017,2024-04-11T01:24:11.870,Modified,"A vulnerability was found in hongmaple octopus 1.0. It has been classified as critical. Affected is an unknown function of the file /system/dept/edit. The manipulation of the argument ancestors leads to sql injection. It is possible to launch the attack remotely. The exploit has been disclosed to the public and may be used. Continious delivery with rolling releases is used by this product. Therefore, no version details of affected nor updated releases are available. VDB-252042 is the identifier assigned to this vulnerability.",NETWORK,LOW,NONE,NONE,UNCHANGED,HIGH,HIGH,HIGH,3.9,5.9,9.8,CRITICAL,CWE-89
CVE-2024-23855,2024-01-25T14:15:27.183,2024-02-15T10:15:09.167,Modified,"A vulnerability has been reported in Cups Easy (Purchase & Inventory), version 1.0, whereby user-controlled inputs are not sufficiently encoded, resulting in a Cross-Site Scripting (XSS) vulnerability via /cupseasylive/taxcodemodify.php, in multiple parameters. Exploitation of this vulnerability could allow a remote attacker to send a specially crafted URL to an authenticated user and steal their session cookie credentials.",NETWORK,LOW,NONE,REQUIRED,CHANGED,LOW,LOW,NONE,2.8,2.7,6.1,MEDIUM,CWE-79
CVE-2023-7227,2024-01-25T19:15:08.477,2024-01-31T18:46:00.220,Analyzed,"
SystemK NVR 504/508/516 versions 2.3.5SK.30084998 and prior are vulnerable to a command injection vulnerability in the dynamic domain name system (DDNS) settings that could allow an attacker to execute arbitrary commands with root privileges.




",NETWORK,LOW,NONE,NONE,UNCHANGED,HIGH,HIGH,HIGH,3.9,5.9,9.8,CRITICAL,CWE-77
CVE-2024-0911,2024-02-06T15:15:08.827,2024-02-14T18:15:48.077,Modified,"A flaw was found in indent, a program for formatting C code. This issue may allow an attacker to trick a user into processing a specially crafted file to trigger a heap-based buffer overflow, causing the application to crash.",LOCAL,LOW,LOW,NONE,UNCHANGED,NONE,NONE,HIGH,1.8,3.6,5.5,MEDIUM,CWE-787
CVE-2023-51833,2024-01-25T22:15:07.737,2024-01-31T23:32:20.930,Analyzed,A command injection issue in TRENDnet TEW-411BRPplus v.2.07_eu that allows a local attacker to execute arbitrary code via the data1 parameter in the debug.cgi page.,NETWORK,HIGH,NONE,NONE,UNCHANGED,HIGH,HIGH,HIGH,2.2,5.9,8.1,HIGH,CWE-77
CVE-2024-0880,2024-01-25T18:15:09.027,2024-04-11T01:24:11.007,Modified,A vulnerability was found in Qidianbang qdbcrm 1.1.0 and classified as problematic. Affected by this issue is some unknown functionality of the file /user/edit?id=2 of the component Password Reset. The manipulation leads to cross-site request forgery. The attack may be launched remotely. The exploit has been disclosed to the public and may be used. The identifier of this vulnerability is VDB-252032. NOTE: The vendor was contacted early about this disclosure but did not respond in any way.,NETWORK,LOW,NONE,REQUIRED,UNCHANGED,HIGH,HIGH,HIGH,2.8,5.9,8.8,HIGH,CWE-352
CVE-2024-22099,2024-01-25T07:15:08.697,2024-03-13T03:15:06.237,Modified,"NULL Pointer Dereference vulnerability in Linux Linux kernel kernel on Linux, x86, ARM (net, bluetooth modules) allows Overflow Buffers. This vulnerability is associated with program files /net/bluetooth/rfcomm/core.C.

This issue affects Linux kernel: v2.6.12-rc2.

",LOCAL,LOW,LOW,NONE,UNCHANGED,NONE,NONE,HIGH,1.8,3.6,5.5,MEDIUM,CWE-476
CVE-2024-21620,2024-01-25T23:15:09.680,2024-02-01T20:20:19.847,Analyzed,"An Improper Neutralization of Input During Web Page Generation ('Cross-site Scripting') vulnerability in J-Web of Juniper Networks Junos OS on SRX Series and EX Series allows an attacker to construct a URL that when visited by another user enables the attacker to execute commands with the target's permissions, including an administrator.

A specific invocation of the emit_debug_note method in webauth_operation.php will echo back the data it receives.

This issue affects Juniper Networks Junos OS on SRX Series and EX Series:
  *  All versions earlier than 20.4R3-S10;
  *  21.2 versions earlier than 21.2R3-S8;
  *  21.4 versions earlier than 21.4R3-S6;
  *  22.1 versions earlier than 22.1R3-S5;
  *  22.2 versions earlier than 22.2R3-S3;
  *  22.3 versions earlier than 22.3R3-S2;
  *  22.4 versions earlier than 22.4R3-S1;
  *  23.2 versions earlier than 23.2R2;
  *  23.4 versions earlier than 23.4R2.


",NETWORK,LOW,NONE,REQUIRED,CHANGED,LOW,LOW,NONE,2.8,2.7,6.1,MEDIUM,CWE-79
CVE-2024-23655,2024-01-25T20:15:40.913,2024-01-31T23:26:33.637,Analyzed,"Tuta is an encrypted email service. Starting in version 3.118.12 and prior to version 3.119.10, an attacker is able to send a manipulated email so that the user can no longer use the app to get access to received emails. By sending a manipulated email, an attacker could put the app into an unusable state. In this case, a user can no longer access received e-mails. Since the vulnerability affects not only the app, but also the web application, a user in this case has no way to access received emails. This issue was tested with iOS and the web app, but it is possible all clients are affected. Version 3.119.10 fixes this issue.",NETWORK,LOW,NONE,NONE,UNCHANGED,NONE,NONE,LOW,3.9,1.4,5.3,MEDIUM,NVD-CWE-noinfo
CVE-2024-0883,2024-01-25T19:15:08.940,2024-04-11T01:24:11.197,Modified,A vulnerability was found in SourceCodester Online Tours & Travels Management System 1.0. It has been declared as critical. This vulnerability affects the function prepare of the file admin/pay.php. The manipulation of the argument id leads to sql injection. The attack can be initiated remotely. The exploit has been disclosed to the public and may be used. VDB-252034 is the identifier assigned to this vulnerability.,NETWORK,LOW,NONE,NONE,UNCHANGED,HIGH,HIGH,HIGH,3.9,5.9,9.8,CRITICAL,CWE-89
CVE-2023-52251,2024-01-25T21:15:08.787,2024-02-29T01:42:07.630,Modified,An issue discovered in provectus kafka-ui 0.4.0 through 0.7.1 allows remote attackers to execute arbitrary code via the q parameter of /api/clusters/local/topics/{topic}/messages.,NETWORK,LOW,LOW,NONE,UNCHANGED,HIGH,HIGH,HIGH,2.8,5.9,8.8,HIGH,CWE-94
